{"court":"臺灣臺北地方法院","date":"2013-01-31T00:00:00+08:00","no":"101,北簡,11731","sys":"民事","reason":"清償債務","judgement":"臺灣臺北地方法院簡易民事判決\r\n　　　　　　　　　　　　　　　　　　　101年度北簡字第11731號\r\n原　　　告　中國信託商業銀行股份有限公司\r\n法定代理人　童兆勤\r\n訴訟代理人　何宣鋐\r\n　　　　　　林志淵\r\n被　　　告　周依青\r\n上列當事人間請求清償債務事件，本院於民國102 年1 月23日言\r\n詞辯論終結，判決如下︰\r\n    主  文\r\n被告應給付原告新臺幣壹拾陸萬玖仟柒佰參拾壹元，及其中新臺\r\n幣壹拾伍萬零捌佰伍拾貳元部分，自民國八十六年五月一日起至\r\n清償日止，按年息百分之二十計算之利息。\r\n訴訟費用新臺幣參仟壹佰貳拾元由被告負擔。\r\n本判決得假執行。但被告如以新臺幣壹拾陸萬玖仟柒佰參拾壹元\r\n為原告預供擔保，得免為假執行。\r\n    事實及理由\r\n一、本件被告經合法通知，未於言詞辯論期日到場，核無民事訴\r\n    訟法第386 條所列各款情形，爰依原告之聲請，由其一造辯\r\n    論而為判決。\r\n二、本件原告起訴時之法定代理人為辜濓松，嗣於本院審理中，\r\n    變更為童兆勤，並由其具狀聲明承受訴訟，核無不合，應予\r\n    准許。\r\n三、原告起訴主張：被告於民國83年2月21日與其訂立信用卡使\r\n    用契約，並領用卡號0000000000000000號之萬事達信用卡，\r\n    依約被告即得於特約商店簽帳消費及預借現金，但應於當期\r\n    繳款截止日前清償或以循環信用方式繳付最低應繳金額。如\r\n    被告未依約繳款，即喪失期限利益，原告有權請求被告一次\r\n    還清欠款，並得請求被告給付將每筆得計入循環信用本金之\r\n    帳款，自各筆帳款入帳日起至清償日止，以年息20％計算之\r\n    循環利息，並合意以本院為第一審管轄法院。詎被告至86年\r\n    4 月30日止，共計消費記帳新臺幣（下同）169,731 元（含\r\n    本金150,852 元、利息17,369元、費用1,510 元），未依約\r\n    清償，屢經催討，均置之不理。爰依兩造間之信用卡使用契\r\n    約，提起本件訴訟，並聲明如主文第1 項所示等語。\r\n四、經查，原告主張之事實，業據提出與其所述相符之證據資料\r\n    為證。被告經本院合法通知後，既未於言詞辯論期日到場爭\r\n    執，復未提出書狀答辯以供本院斟酌，本院審酌原告所提證\r\n    據，堪認其主張為真實。從而，原告請求被告給付如主文所\r\n    示，為有理由，應予准許。\r\n五、本件係就民事訴訟法第427 條訴訟適用簡易程序所為被告敗\r\n    訴之判決，爰依同法第389 條第1 項第3 款之規定，職權宣\r\n    告假執行。並依同法第392 條第2 項，依職權為被告預供擔\r\n    保，得免為假執行之宣告。\r\n六、本件訴訟費用額，依後附計算書確定如主文所示之金額。\r\n中    華    民    國   102    年    1     月    31    日\r\n                              臺北簡易庭\r\n                                  法  官  邱士賓\r\n      計    算    書\r\n項        目          金      額（新臺幣）      備    註\r\n第一審裁判費               1,770  元\r\n第一審公示送達登報費       1,350  元\r\n合        計               3,120  元\r\n以上正本證明與原本無異。\r\n如不服本判決，應於判決送達後20日內向本庭（臺北市○○○路\r\n0段000巷0號）提出上訴狀。（須按他造當事人之人數附繕本）\r\n如委任律師提起上訴者，應一併繳納上訴審裁判費。\r\n中    華    民    國   102    年    1     月    31    日\r\n                                 書記官  陳麗欽","type":"判決","historyHash":"","mainText":"被告應給付原告新臺幣壹拾陸萬玖仟柒佰參拾壹元，及其中新臺幣壹拾伍萬零捌佰伍拾貳元部分，自民國八十六年五月一日起至清償日止，按年息百分之二十計算之利息。\n訴訟費用新臺幣參仟壹佰貳拾元由被告負擔。\n本判決得假執行。但被告如以新臺幣壹拾陸萬玖仟柒佰參拾壹元為原告預供擔保，得免為假執行。","opinion":"四、經查，原告主張之事實，業據提出與其所述相符之證據資料為證。被告經本院合法通知後，既未於言詞辯論期日到場爭執，復未提出書狀答辯以供本院斟酌，本院審酌原告所提證據，堪認其主張為真實。從而，原告請求被告給付如主文所示，為有理由，應予准許。\n五、本件係就民事訴訟法第427 條訴訟適用簡易程序所為被告敗訴之判決，爰依同法第389 條第1 項第3 款之規定，職權宣告假執行。並依同法第392 條第2 項，依職權為被告預供擔保，得免為假執行之宣告。\n六、本件訴訟費用額，依後附計算書確定如主文所示之金額。","relatedIssues":[{"lawName":"民事訴訟法","issueRef":"386"},{"lawName":"民事訴訟法","issueRef":"389 1 3"},{"lawName":"民事訴訟法","issueRef":"392 2"},{"lawName":"民事訴訟法","issueRef":"427"}],"party":[{"group":["plaintiff"],"title":"原告","value":"中國信託商業銀行股份有限公司"},{"group":[],"title":"法定代理人","value":"童兆勤"},{"group":["plaintiff","agentAdLitem"],"title":"訴訟代理人","value":"何宣鋐"},{"group":["plaintiff","agentAdLitem"],"title":"訴訟代理人","value":"林志淵"},{"group":["defendant"],"title":"被告","value":"周依青"}]}
